{
  "schema_version": "1.1.3",
  "project_id": "QA-PE-20261003-LIVE",
  "stage": "AWAITING_USER",
  "report_context": {
    "title": "配电负荷异常识别 QA 技术报告",
    "goal": "在模拟参考数据上完成配电负荷异常识别技术链的 QA 验收并形成技术报告",
    "report_type": "科技项目结题技术报告",
    "task_book": {
      "available": true,
      "scope": "课题",
      "topic_name_or_number": "配电负荷异常识别（QA 任务书具体课题，非企业正式任务书总报告）"
    },
    "report_constraints": {
      "has_requirements": true,
      "target_words": 5000,
      "template": "套件原生电力技术报告规则，最终 Word 与 LaTeX 可编辑成果",
      "chapter_count": 3
    },
    "experimental_data": {
      "available": true,
      "description": "28 条人工构造记录；真实沙盒计算，16 条校准、12 条验证，阈值预先固定；证据类型 SYNTHETIC_QA_COMPUTATION",
      "files_or_locations": [
        "qa-report-load.csv",
        "qa-report-analyze.py",
        "qa-report-results.json"
      ]
    },
    "expected_length": 5000,
    "template_requirement": "套件原生电力技术报告规则，最终 Word 与 LaTeX 可编辑成果",
    "chapter_count_requirement": 3
  },
  "content_generation_mode": "source_grounded",
  "project_intake": {
    "status": "confirmed",
    "answers": {
      "task_book": {
        "available": true,
        "scope": "课题",
        "topic_name_or_number": "配电负荷异常识别（QA 任务书具体课题，非企业正式任务书总报告）"
      },
      "content_generation_mode": "source_grounded",
      "report_constraints": {
        "has_requirements": true,
        "target_words": 5000,
        "template": "套件原生电力技术报告规则，最终 Word 与 LaTeX 可编辑成果",
        "chapter_count": 3
      },
      "experimental_data": {
        "available": true,
        "description": "28 条人工构造记录；真实沙盒计算，16 条校准、12 条验证，阈值预先固定；证据类型 SYNTHETIC_QA_COMPUTATION",
        "files_or_locations": [
          "qa-report-load.csv",
          "qa-report-analyze.py",
          "qa-report-results.json"
        ]
      }
    },
    "submitted_at": "2026-10-03T00:21:44.276703+00:00"
  },
  "chapter_content_briefs": {
    "status": "confirmed",
    "targets": [
      {
        "chapter_key": "ch1",
        "suggested_title": "项目概述"
      },
      {
        "chapter_key": "ch2",
        "suggested_title": "配电负荷异常识别"
      },
      {
        "chapter_key": "ch3",
        "suggested_title": "总结"
      }
    ],
    "items": [
      {
        "chapter_key": "ch1",
        "approximate_content": "第1章《项目概述》约1500字，QA背景、单变量问题、国内公开摘要与NIST方法及UCI背景来源、研究内容和思路。",
        "available_materials": [
          "qa-report-task.md",
          "qa-report-sources.json"
        ],
        "known_data_or_results": [
          "研究范围：单变量配电负荷疑似异常标记"
        ]
      },
      {
        "chapter_key": "ch2",
        "approximate_content": "第2章《配电负荷异常识别》约2750字，完整说明16条校准/12条验证分离、中位数/MAD、严格阈值的修正Z分数、全部公式与符号、实际结果表、V09/V10边界误报、普通Z对照、适用限制及本章小结。",
        "available_materials": [
          "qa-report-load.csv",
          "qa-report-analyze.py",
          "qa-report-results.json"
        ],
        "known_data_or_results": [
          "中位数100 kW",
          "MAD 1 kW",
          "修正Z F1=0.80 误报1",
          "普通Z F1≈0.667 误报2",
          "边界误报 V09=105kW(仅普通Z) V10=108kW(两者)"
        ]
      },
      {
        "chapter_key": "ch3",
        "approximate_content": "第3章《总结》700–800字，仅一级标题，逐项完成情况和小样本/合成标签/单变量/固定阈值限制。",
        "available_materials": [
          "qa-report-results.json"
        ],
        "known_data_or_results": [
          "两项验收条件均满足"
        ]
      }
    ],
    "submitted_at": "2026-10-03T00:28:37.052104+00:00"
  },
  "current_chapter_id": "2",
  "chapter_order": [
    "1",
    "2",
    "3"
  ],
  "artifacts": {
    "project_profile": {
      "versions": [
        {
          "artifact_type": "project_profile",
          "artifact_id": "profile-1",
          "version": 1,
          "content": {
            "report_title": "配电负荷异常识别 QA 技术报告",
            "report_type": "科技项目结题技术报告",
            "report_theme_type": "non-evaluation",
            "content_generation_mode": "source_grounded",
            "project_background": "本报告面向 PowerEvolve 产品验收中的配电负荷异常识别课题。全部负荷数据为人工构造的模拟参考记录，不是企业实测数据，也不代表任何现场运行条件。研究范围限定为单变量配电负荷的疑似异常标记，覆盖校准数据分离、稳健尺度估计、固定阈值标记及评价读回，不涉及电网现场性能评价、故障诊断或窃电认定。",
            "application_scenario": "配电负荷质量核查与可疑数据筛查的 QA 参考流程，用于验证中位数-中位数绝对偏差-修正 Z 分数技术链在模拟算例上的正确性与可复现性。",
            "overall_problem": "在无现场标注、样本量很小的条件下，如何用一个可复现、阈值事先固定的单变量稳健统计流程，把配电负荷记录中的疑似异常标记出来，并给出可核对的精确率、召回率、F1 与误报数。",
            "target_readers": "QA 验收人员、配电数据质量分析人员与方法复现人员。",
            "report_purpose": "逐项映射 QA 任务书要求、真实脚本结果与已知限制，形成可复现的模拟参考验收记录。",
            "research_contents": [
              "校准集稳健中心与尺度估计（中位数与中位数绝对偏差）",
              "修正 Z 分数计算与疑似异常标记",
              "混淆矩阵评价与普通 Z 分数对照"
            ],
            "available_materials": [
              "qa-report-task.md（QA 任务书）",
              "qa-report-load.csv（28 条模拟记录，16 校准 / 12 验证）",
              "qa-report-analyze.py（分析脚本）",
              "qa-report-results.json（真实沙盒计算结果）",
              "qa-report-sources.json（公开来源元数据）",
              "qa-report-cover.json（封面元数据）"
            ],
            "known_data_and_results": "校准集 16 条：中位数 100 kW，MAD 1 kW，均值 100 kW，样本标准差约 1.2649 kW（仅用校准集估计）。验证集 12 条：修正 Z 分数 TP=2、FP=1、TN=9、FN=0，精确率约 0.667、召回率 1.0、F1=0.80、准确率约 0.917，标记 V05、V06、V10；对照普通 Z 分数 TP=2、FP=2，F1≈0.667，额外标记 V09。验收条件 F1≥0.75 与误报≤1 均满足。",
            "target_length": 5000,
            "output_format": "Markdown 正文 + Word/LaTeX 可编辑成果",
            "special_requirements": [
              "全部数据为人工构造的模拟参考记录，报告须明确范围，不得解释为电网现场性能、故障诊断或窃电认定",
              "阈值事先固定，不得用验证标签调参；MAD 为零时拒绝计算，不自行替换尺度",
              "不得填造吞吐、耗时、准确率或外部论文实验结果",
              "参考文献采用 GB/T 7714 顺序编码，元数据仅取 qa-report-sources.json，不编造作者或页码",
              "所有定量结论须注明来自这 12 条模拟验证记录"
            ],
            "assumptions": [
              "需求方接受以模拟参考数据完成 QA 验收",
              "报告按套件原生三章结构与约 5000 字篇幅生成"
            ],
            "task_book_scope": "QA 任务书中的具体课题《配电负荷异常识别》，非企业正式任务书总报告",
            "has_task_book": true,
            "task_book_topic_or_total_report": "具体课题",
            "specified_template": "套件原生电力技术报告规则（最终 Word 与 LaTeX 可编辑成果）",
            "specified_chapter_count": 3,
            "experimental_data_availability": "有，28 条人工构造记录的模拟参考试验，真实沙盒计算，证据类型 SYNTHETIC_QA_COMPUTATION",
            "chapter_word_allocation": [
              {
                "chapter_no": 1,
                "title": "项目概述",
                "target_words": 1500
              },
              {
                "chapter_no": 2,
                "title": "配电负荷异常识别",
                "target_words": 2750
              },
              {
                "chapter_no": 3,
                "title": "总结",
                "target_words": 750
              }
            ]
          },
          "summary": "建立配电负荷异常识别 QA 技术报告的项目档案草案，固定四项前置信息并给出三章约 5000 字分配。"
        }
      ],
      "reviews": [],
      "approved_version": null
    },
    "argument_architecture": {
      "versions": [
        {
          "artifact_type": "argument_architecture",
          "artifact_id": "arch-1",
          "version": 1,
          "content": {
            "central_thesis": "面向无现场标注、小样本的配电负荷质量核查场景，以校准集稳健中位数与中位数绝对偏差构造修正 Z 分数，在事先固定阈值下把配电负荷记录标记为疑似异常，并用混淆矩阵评价链给出可核对的精确率、召回率、F1 与误报数，形成可复现的模拟参考验收记录。",
            "problem_reasoning": "总体问题是在单变量配电负荷上判断哪些记录应被标记为疑似异常。关键挑战有三：一是校准集与验证集必须严格分离，中心与尺度只能用校准集估计，避免尺度泄漏；二是样本量很小（16 条校准、12 条验证），普通均值-标准差尺度对极端值敏感，需要稳健尺度；三是阈值必须事先固定，不能用验证标签调参。研究内容依次完成稳健中心-尺度估计、修正 Z 分数标记、混淆矩阵评价与普通 Z 分数对照，共同验证技术链的正确性与可复现性。",
            "evidence_chain": "校准集 16 条负荷 → 中位数 100 kW 与 MAD 1 kW（仅校准集估计）→ 修正 Z 分数（比例因子 0.6745、阈值严格大于 3.5）→ 12 条验证记录混淆矩阵 → 修正 Z 分数 TP=2、FP=1、TN=9、FN=0，F1=0.80、误报 1，标记 V05、V06、V10；对照普通 Z 分数 F1≈0.667、误报 2，额外标记 V09；两项验收条件（F1≥0.75、误报≤1）均满足。",
            "chapter_roles": {
              "ch1": "基础章，交代课题问题、国内外公开方法背景与研究范围，并逐项列出研究内容与思路，为第2章技术链提供问题定义与边界。",
              "ch2": "技术研究章，唯一承接完整技术链：校准集稳健中心-尺度估计 → 修正 Z 分数标记 → 混淆矩阵评价与普通 Z 分数对照，不拆分为额外章节。",
              "ch3": "总结章，按总体目标收束，逐项归纳任务完成情况并说明小样本、合成标签、单变量与固定阈值的限制。"
            },
            "proposed_chapters": [
              {
                "chapter_id": "ch1",
                "chapter_no": 1,
                "chapter_title": "项目概述",
                "chapter_type": "foundation"
              },
              {
                "chapter_id": "ch2",
                "chapter_no": 2,
                "chapter_title": "配电负荷异常识别",
                "chapter_type": "technical-research"
              },
              {
                "chapter_id": "ch3",
                "chapter_no": 3,
                "chapter_title": "总结",
                "chapter_type": "conclusion"
              }
            ],
            "report_scope_confirmation": {
              "scope": "仅 QA 任务书中的配电负荷异常识别课题，非企业正式任务书总报告；技术章固定为第2章一章，不分裂。",
              "excluded": [
                "多变量用户用电异常辨析",
                "窃电认定与电力故障诊断",
                "现场运行性能评价",
                "吞吐、耗时等未经测量的性能指标",
                "外部论文或数据集的实验结果"
              ],
              "chapter_mapping": [
                {
                  "chapter_id": "ch1",
                  "chapter_no": 1,
                  "chapter_title": "项目概述",
                  "chapter_type": "foundation"
                },
                {
                  "chapter_id": "ch2",
                  "chapter_no": 2,
                  "chapter_title": "配电负荷异常识别",
                  "chapter_type": "technical-research"
                },
                {
                  "chapter_id": "ch3",
                  "chapter_no": 3,
                  "chapter_title": "总结",
                  "chapter_type": "conclusion"
                }
              ]
            }
          },
          "summary": "确定中心主旨与论证架构：课题问题—技术链—章节—真实证据一一对应；固定3章，第2章唯一承接校准—修正分数—评价完整链。"
        }
      ],
      "reviews": [],
      "approved_version": 1
    },
    "outline": {
      "versions": [
        {
          "artifact_type": "outline",
          "artifact_id": "outline-1",
          "version": 1,
          "content": {
            "task_book_scope": "specific_topic",
            "report_theme_type": "non-evaluation",
            "target_words": 5000,
            "references_required": true,